name,phone,company,postcode,area,pms,segment,tier,adg_corporate,adg_group,bda_good_practice,website,notes
The Smile Clinic Colchester Town,01206 767471,The Smile Clinic Colchester Town,CO2 7EA,Colchester & Clacton (CO2),Dentally,Dentally confirmed,Tier 1 - Dentally integration ready,No,,No,https://www.thesmileclinic.uk.com,
Creffield Lodge Dental Practice,01206 572093,Creffield Lodge Dental Practice,CO3 3JA,Colchester & Clacton (CO3),Dentally,Dentally confirmed,Tier 1 - Dentally integration ready,No,,No,https://www.creffieldlodge.co.uk,
"The Smile Clinic, Mill Road, Mile End",01206 851448,"The Smile Clinic, Mill Road, Mile End",CO4 5LJ,Colchester & Clacton (CO4),Dentally,Dentally confirmed,Tier 1 - Dentally integration ready,No,,No,https://www.thesmileclinic.uk.com,
Together Dental Colchester (Queen Street),01206 576117,Together Dental Colchester (Queen Street),CO1 2PJ,Colchester & Clacton (CO1),Dentally,Dentally confirmed,Tier 4 - ADG corporate group (lower priority),Yes,Together Dental,No,https://www.together.dental/colchester-queen-street,
Together Dental Clacton,01255 221001,Together Dental Clacton,CO15 3BW,Colchester & Clacton (CO15),Dentally,Dentally confirmed,Tier 4 - ADG corporate group (lower priority),Yes,Together Dental,No,https://www.together.dental/clacton,
Together Dental Colchester (Country Park),01206 751175,Together Dental Colchester (Country Park),CO4 9SR,Colchester & Clacton (CO4),Dentally,Dentally confirmed,Tier 4 - ADG corporate group (lower priority),Yes,Together Dental,No,https://www.together.dental/colchester-country-park/,
Together Dental Halstead,01787 472202,Together Dental Halstead,CO9 2JN,Colchester & Clacton (CO9),Dentally,Dentally confirmed,Tier 4 - ADG corporate group (lower priority),Yes,Together Dental,No,https://www.together.dental/halstead/,
